{
  "$schema": "http://json-schema.org/draft-07/schema#",
  "title": "Pact contract metadata",
  "type": "object",
  "required": ["name", "version"],
  "properties": {
    "name": {"type": "string"},
    "version": {"type": "string", "pattern": "^\\d+\\.\\d+\\.\\d+$"},
    "description": {"type": "string"},
    "authors": {
      "type": "array",
      "items": {
        "oneOf": [
          {"type": "string"},
          {"type": "object", "properties": {"name": {"type": "string"}}, "required": ["name"], "additionalProperties": true}
        ]
      }
    },
    "license": {"type": "string"},
    "repository": {"type": "string", "format": "uri"},
    "keywords": {"type": "array", "items": {"type": "string"}},
    "slug": {"type": "string"},
    "audit_status": {"type": "string"},
    "tags": {"type": "array", "items": {"type": "string"}}
  },
  "additionalProperties": true
}
