[
  {
    "name": "Example Contract",
    "slug": "example-contract",
    "version": "0.1.0",
    "repository": "https://github.com/Pact-Community-Organization/example-contract",
    "license": "MIT",
    "authors": [
      {
        "name": "Example Maintainer"
      }
    ],
    "audit_status": "not-audited",
    "tags": [
      "example"
    ]
  }
]
